{
  "action": "CREATE_HANDOFF",
  "request_id": "REQ-0042",
  "plan_id": "PLAN-0042",
  "handoff_id": "HANDOFF-0042-A",
  "design_reference": {
    "file_url": "https://www.figma.com/design/AbC123/Checkout-redesign?node-id=42%3A17",
    "node_ids": ["42:17", "42:30"]
  },
  "task_mappings": [
    {
      "task_id": "TASK-0042-UI",
      "design_node_ids": ["42:17", "42:30"],
      "acceptance_criteria": [
        {
          "criterion_id": "AC-0042-1",
          "description": "The checkout summary displays the selected items and total."
        },
        {
          "criterion_id": "AC-0042-2",
          "description": "The primary action remains visibly distinguishable from secondary actions."
        }
      ]
    }
  ]
}
